{
  "protocol_version": "0.2",
  "example": true,
  "model": "Qwen 3 14B",
  "model_id": "Qwen/Qwen3-14B",
  "gpu": "H100 80GB HBM3 SXM",
  "num_gpus": 1,
  "tensor_parallel": 1,
  "data_parallel": 1,
  "expert_parallel": 1,
  "precision": "BF16",
  "max_num_seqs": 64,
  "avg_running_batch": 63.8,
  "joules_per_output_token": 0.1671736,
  "wh_per_million_output_tokens": 46.44,
  "median_itl_ms": 18.9,
  "p90_itl_ms": 21.7,
  "p99_itl_ms": 45.0,
  "p95_itl_ms": 23.1,
  "ttft_median_ms": null,
  "tokens_per_second": 3140.3,
  "gpu_power_watts_total": 525,
  "avg_output_tokens": 617,
  "avg_prompt_tokens": 1000,
  "window_seconds": 300,
  "requests_in_window": 1024,
  "runs": [{"joules_per_output_token": 0.1671736}, {"joules_per_output_token": 0.1671736}],
  "mig_profile": "3g.40gb",
  "slice_count": 2,
  "slices_loaded": 2,
  "engine": "vLLM",
  "engine_version": "0.11.1",
  "driver_version": "EXAMPLE",
  "cuda_version": "EXAMPLE",
  "energy_source": "dcgm_total_energy",
  "prompt_set": "lmarena-ai/arena-human-preference-100k, train, conversation_a, seed 0",
  "measured_on": "2026-09-26",
  "contributor": "EXAMPLE",
  "affiliation": null,
  "vendor_affiliation": null,
  "host_power_watts": null,
  "site_pue": null,
  "site_wue_l_per_kwh": null,
  "logs": ["EXAMPLE-dcgm-energy.csv", "EXAMPLE-vllm-metrics.log", "EXAMPLE-vllm-bench-serve.json"],
  "notes": "EXAMPLE FILE, NOT A MEASUREMENT. It shows every field of the schema filled in for a MIG pair (two 3g.40gb slices on one H100, both loaded). The energy, latency, throughput and power values are copied from the public ML.ENERGY row for Qwen 3 14B on a whole 1 x H100 at a cap of 64 only to give realistic magnitudes; avg_prompt_tokens, window_seconds, requests_in_window and the run values are placeholders. The build validates this file against the schema and never publishes it."
}
